{"checkpoint_id":"36e25fb49bd95c3be33a0b2a259c49b3c4b77889d5530fb2cff42ffb749c22e3","genesis_id":"974cd4da89feb9f7ae8e14d7b4359f4b76d8697f55e5793219c52e38b627b7de","instructions":["Retain this value outside the ledger directory and require it on later verification or commit."],"non_claims":["This repository copy is a format demonstration, not an independently held or trusted timestamped anchor."],"receipt_head":"fedc92b971f0ea59586678297a981c950d2ac8646e8cf30f79bffc7537893ffc","record_head":"2a5ce61d76e3ee38e0013b734dff9c290e43d45afc9c4d7dad0b88b8e902a655","schema":"nexus.pcx-external-head-anchor/v0","state_root":"1b28ac32d6067a7b1bd2ec8b7097b341d891a2793a63c606da0c9eecf221598f","status_authority":"NONE"}
